{
	"schema_version": 1,
	"policy_id": "linux-cua-node-compliance",
	"target": "linux-x64-glibc",
	"release_status": "clear",
	"determinism": {
		"fixed_timestamp": "1970-01-01T00:00:00Z",
		"component_sort_key": "id",
		"network_access": "not-used"
	},
	"external_requirements": [
		{
			"id": "system-browser",
			"kind": "runtime-dependency",
			"platform": "linux",
			"requirement": "A supported system-installed Chromium-family browser executable must be available to Playwright at runtime.",
			"redistribution": "not-redistributed",
			"sbom_distribution_component": false,
			"notes": "The cua_node payload ships Playwright JavaScript packages only; browser installation, updates, licensing, and notices remain the host system's responsibility."
		}
	],
	"dispositions": [
		{
			"id": "routine-notice-clearance",
			"summary": "Use the authoritative release/package source and collect the ordinary license and notice files before bundling.",
			"release_blocking": false,
			"required_evidence": [
				"authoritative-source",
				"version",
				"license-text",
				"component-notices"
			]
		},
		{
			"id": "provenance-only-gate",
			"summary": "The bytes may be usable after exact-origin, version, hash, and license provenance are recorded; no source-build reconstruction is required.",
			"release_blocking": true,
			"required_evidence": [
				"exact-origin",
				"exact-version-or-revision",
				"sha256",
				"license-and-notice-provenance"
			]
		},
		{
			"id": "unresolved-evidence-gate",
			"summary": "Release remains blocked until the named build, corresponding source, composition, and notice evidence is complete.",
			"release_blocking": true,
			"required_evidence": [
				"exact-artifact",
				"build-or-composition-evidence",
				"corresponding-source",
				"license-and-component-notices"
			]
		}
	],
	"components": [
		{
			"id": "acorn",
			"name": "Acorn",
			"version": "8.19.0",
			"kind": "npm-package",
			"purl": "pkg:npm/acorn@8.19.0",
			"disposition": "routine-notice-clearance",
			"release_effect": "notice-clearance-required",
			"license": { "spdx_expression": "MIT", "designation": "MIT" },
			"source": {
				"uri": "https://registry.npmjs.org/acorn/-/acorn-8.19.0.tgz",
				"kind": "npm",
				"provenance_status": "artifact-provenance-resolved"
			},
			"notice_ids": ["acorn-license"],
			"blocking_gate_ids": [],
			"notes": "The exact Acorn 8.19.0 prepared package tree, registry integrity, and MIT license are pinned by runtime-lock.json."
		},
		{
			"id": "acorn-walk",
			"name": "Acorn Walk",
			"version": "8.3.5",
			"kind": "npm-package",
			"purl": "pkg:npm/acorn-walk@8.3.5",
			"disposition": "routine-notice-clearance",
			"release_effect": "notice-clearance-required",
			"license": { "spdx_expression": "MIT", "designation": "MIT" },
			"source": {
				"uri": "https://registry.npmjs.org/acorn-walk/-/acorn-walk-8.3.5.tgz",
				"kind": "npm",
				"provenance_status": "artifact-provenance-resolved"
			},
			"notice_ids": ["acorn-walk-license"],
			"blocking_gate_ids": [],
			"notes": "The exact Acorn Walk 8.3.5 prepared package tree, registry integrity, and MIT license are pinned by runtime-lock.json."
		},
		{
			"id": "node-runtime",
			"name": "Node.js",
			"version": "24.14.0",
			"kind": "runtime",
			"purl": "pkg:generic/node@24.14.0",
			"disposition": "routine-notice-clearance",
			"release_effect": "notice-clearance-required",
			"license": {
				"spdx_expression": "LicenseRef-Node.js",
				"designation": "Node.js License"
			},
			"source": {
				"uri": "https://nodejs.org/dist/v24.14.0/node-v24.14.0-linux-x64.tar.xz",
				"kind": "official-release",
				"provenance_status": "artifact-provenance-resolved"
			},
			"notice_ids": ["node-license"],
			"blocking_gate_ids": [],
			"notes": "Exact Linux x64 glibc archive provenance is resolved; release license and notice clearance remains."
		},
		{
			"id": "npm",
			"name": "npm",
			"version": "11.9.0",
			"kind": "runtime-tool",
			"purl": "pkg:npm/npm@11.9.0",
			"disposition": "routine-notice-clearance",
			"release_effect": "notice-clearance-required",
			"license": {
				"spdx_expression": "Artistic-2.0",
				"designation": "Artistic-2.0"
			},
			"source": {
				"uri": "https://registry.npmjs.org/npm/-/npm-11.9.0.tgz",
				"kind": "npm",
				"provenance_status": "planned-authoritative-source"
			},
			"notice_ids": ["npm-license"],
			"blocking_gate_ids": [],
			"notes": "Clear the npm license and bundled dependency notices from the exact Node 24.14.0 distribution context."
		},
		{
			"id": "corepack",
			"name": "Corepack",
			"version": "0.34.6",
			"kind": "runtime-tool",
			"purl": "pkg:npm/corepack@0.34.6",
			"disposition": "routine-notice-clearance",
			"release_effect": "notice-clearance-required",
			"license": { "spdx_expression": "MIT", "designation": "MIT" },
			"source": {
				"uri": "https://registry.npmjs.org/corepack/-/corepack-0.34.6.tgz",
				"kind": "npm",
				"provenance_status": "planned-authoritative-source"
			},
			"notice_ids": ["corepack-license"],
			"blocking_gate_ids": [],
			"notes": "Routine notice clearance for the exact pinned Corepack package."
		},
		{
			"id": "playwright",
			"name": "Playwright",
			"version": "1.57.0",
			"kind": "npm-package",
			"purl": "pkg:npm/playwright@1.57.0",
			"disposition": "routine-notice-clearance",
			"release_effect": "notice-clearance-required",
			"license": {
				"spdx_expression": "Apache-2.0",
				"designation": "Apache-2.0 plus Playwright third-party notices"
			},
			"source": {
				"uri": "https://registry.npmjs.org/playwright/-/playwright-1.57.0.tgz",
				"kind": "npm",
				"provenance_status": "planned-authoritative-source"
			},
			"notice_ids": ["playwright-license", "playwright-third-party"],
			"blocking_gate_ids": [],
			"notes": "The shipped payload contains the Playwright JavaScript package only; Linux browser execution uses the external system-browser requirement."
		},
		{
			"id": "playwright-core",
			"name": "Playwright Core",
			"version": "1.57.0",
			"kind": "npm-package",
			"purl": "pkg:npm/playwright-core@1.57.0",
			"disposition": "routine-notice-clearance",
			"release_effect": "notice-clearance-required",
			"license": {
				"spdx_expression": "Apache-2.0",
				"designation": "Apache-2.0 plus Playwright third-party notices"
			},
			"source": {
				"uri": "https://registry.npmjs.org/playwright-core/-/playwright-core-1.57.0.tgz",
				"kind": "npm",
				"provenance_status": "planned-authoritative-source"
			},
			"notice_ids": ["playwright-license", "playwright-third-party"],
			"blocking_gate_ids": [],
			"notes": "The shipped payload contains the Playwright Core JavaScript package only; no browser or video payload is redistributed."
		},
		{
			"id": "pdfjs-dist",
			"name": "PDF.js",
			"version": "5.4.624",
			"kind": "npm-package",
			"purl": "pkg:npm/pdfjs-dist@5.4.624",
			"disposition": "routine-notice-clearance",
			"release_effect": "notice-clearance-required",
			"license": {
				"spdx_expression": "Apache-2.0",
				"designation": "Apache-2.0 plus PDF.js component notices"
			},
			"source": {
				"uri": "https://registry.npmjs.org/pdfjs-dist/-/pdfjs-dist-5.4.624.tgz",
				"kind": "npm",
				"provenance_status": "planned-authoritative-source"
			},
			"notice_ids": ["pdfjs-license", "pdfjs-third-party"],
			"blocking_gate_ids": [],
			"notes": "Routine notice clearance includes the PDF.js distribution and its component notices."
		},
		{
			"id": "pdfjs-cmaps",
			"name": "PDF.js CMaps",
			"version": "5.4.624",
			"kind": "data",
			"purl": "pkg:generic/pdfjs-cmaps@5.4.624",
			"disposition": "routine-notice-clearance",
			"release_effect": "notice-clearance-required",
			"license": {
				"spdx_expression": "BSD-3-Clause",
				"designation": "BSD-3-Clause"
			},
			"source": {
				"uri": "https://github.com/mozilla/pdf.js/tree/v5.4.624/web/cmaps",
				"kind": "official-release",
				"provenance_status": "artifact-provenance-resolved"
			},
			"notice_ids": ["pdfjs-cmaps-notice"],
			"blocking_gate_ids": [],
			"notes": "The exact shipped CMap tree is BSD-3-Clause and carries share/pdfjs/cmaps/LICENSE."
		},
		{
			"id": "pdfjs-standard-fonts",
			"name": "PDF.js standard fonts",
			"version": "5.4.624",
			"kind": "data",
			"purl": "pkg:generic/pdfjs-standard-fonts@5.4.624",
			"disposition": "routine-notice-clearance",
			"release_effect": "notice-clearance-required",
			"license": {
				"spdx_expression": "BSD-3-Clause AND OFL-1.1",
				"designation": "BSD-3-Clause AND OFL-1.1"
			},
			"source": {
				"uri": "https://github.com/mozilla/pdf.js/tree/v5.4.624/standard_fonts",
				"kind": "official-release",
				"provenance_status": "artifact-provenance-resolved"
			},
			"notice_ids": ["pdfjs-fonts-liberation", "pdfjs-fonts-foxit"],
			"blocking_gate_ids": [],
			"notes": "The exact shipped standard-font tree carries the BSD-3-Clause Foxit notice and OFL-1.1 Liberation notice."
		},
		{
			"id": "tesseract-js",
			"name": "Tesseract.js",
			"version": "7.0.0",
			"kind": "npm-package",
			"purl": "pkg:npm/tesseract.js@7.0.0",
			"disposition": "routine-notice-clearance",
			"release_effect": "notice-clearance-required",
			"license": {
				"spdx_expression": "Apache-2.0",
				"designation": "Apache-2.0"
			},
			"source": {
				"uri": "https://registry.npmjs.org/tesseract.js/-/tesseract.js-7.0.0.tgz",
				"kind": "npm",
				"provenance_status": "planned-authoritative-source"
			},
			"notice_ids": ["tesseract-js-license"],
			"blocking_gate_ids": [],
			"notes": "Routine notice clearance for the exact Tesseract.js package."
		},
		{
			"id": "tesseract-js-core",
			"name": "Tesseract.js core",
			"version": "7.0.0",
			"kind": "npm-package",
			"purl": "pkg:npm/tesseract.js-core@7.0.0",
			"disposition": "routine-notice-clearance",
			"release_effect": "notice-clearance-required",
			"license": {
				"spdx_expression": "Apache-2.0",
				"designation": "Apache-2.0"
			},
			"source": {